{
  "schemaVersion": 1,
  "id": "openrouter",
  "name": "OpenRouter",
  "product": "OpenRouter key quota",
  "releaseStatus": "experimental",
  "adapterVersion": "0.1.0",
  "platforms": [
    "darwin"
  ],
  "docsPath": "docs/providers/openrouter.md",
  "documentationUrls": [
    "https://github.com/subsbar/subsbar#readme"
  ],
  "credentialReaders": [
    {
      "id": "openrouter-env-key",
      "kind": "env",
      "credentialKinds": [
        "api-key"
      ],
      "implementationId": "env-generic",
      "configurable": [
        "envName"
      ],
      "requires": [],
      "purposes": [
        "primary"
      ],
      "owner": "external",
      "renewMode": "none"
    },
    {
      "id": "openrouter-subsbar-key",
      "kind": "keychain",
      "credentialKinds": [
        "api-key"
      ],
      "implementationId": "openrouter-subsbar-key",
      "configurable": [
        "service",
        "account"
      ],
      "requires": [
        "keychain"
      ],
      "purposes": [
        "primary"
      ],
      "owner": "subsbar",
      "renewMode": "none",
      "credentialService": "SubsBar credential <providerId>"
    },
    {
      "id": "openrouter",
      "kind": "pi",
      "credentialKinds": [
        "api-key"
      ],
      "implementationId": "openrouter",
      "configurable": [
        "path"
      ],
      "requires": [],
      "purposes": [
        "primary"
      ],
      "owner": "external",
      "renewMode": "none"
    },
    {
      "id": "openrouter-management",
      "kind": "keychain",
      "credentialKinds": [
        "api-key"
      ],
      "implementationId": "openrouter-management-key",
      "configurable": [
        "service",
        "account"
      ],
      "requires": [
        "keychain"
      ],
      "purposes": [
        "management"
      ],
      "owner": "subsbar",
      "renewMode": "none",
      "credentialService": "SubsBar credential <providerId>"
    }
  ],
  "endpoints": [
    {
      "id": "openrouter-key",
      "transport": "https",
      "operation": "usage",
      "readOnly": true,
      "grade": "C",
      "maxResponseBytes": 65536,
      "authPurpose": "primary",
      "documentationUrl": "https://github.com/subsbar/subsbar#readme",
      "method": "GET",
      "origin": "https://openrouter.ai",
      "pathTemplate": "/api/v1/key"
    }
  ],
  "dataSources": [
    {
      "id": "openrouter-key",
      "kind": "official-api",
      "grade": "A",
      "admission": "approved",
      "approvalNote": "docs/providers/openrouter.md；普通 key /api/v1/key 限额；management key 仅账户 credits，独立 purpose 不与 key quota 合并",
      "endpointIds": [
        "openrouter-key"
      ],
      "credentialChain": [
        "openrouter-env-key",
        "openrouter-subsbar-key",
        "openrouter"
      ],
      "capabilities": [
        "quota"
      ],
      "coverageMetricRules": [
        "openrouter-limit"
      ],
      "coverageMatch": "any"
    }
  ],
  "refresh": {
    "minimumIntervalSeconds": 60,
    "defaultIntervalSeconds": 300,
    "taskTimeoutSeconds": 30,
    "requestTimeoutSeconds": 15
  },
  "metricRules": [
    {
      "id": "openrouter-limit",
      "metricId": "limit",
      "kind": "quota",
      "unit": "currency",
      "scope": "subscription",
      "period": "unknown",
      "derivations": [
        "remaining-from-limit-used"
      ],
      "description": "key quota; account credits are separate management purpose",
      "missingPolicy": "unknown",
      "currency": "USD"
    },
    {
      "id": "openrouter-usage-daily",
      "metricId": "usage-daily",
      "kind": "spend",
      "unit": "currency",
      "scope": "api-key",
      "period": "unknown",
      "derivations": [],
      "currency": "USD",
      "description": "daily spend USD",
      "missingPolicy": "omit-optional"
    },
    {
      "id": "openrouter-usage-weekly",
      "metricId": "usage-weekly",
      "kind": "spend",
      "unit": "currency",
      "scope": "api-key",
      "period": "unknown",
      "derivations": [],
      "currency": "USD",
      "description": "weekly spend USD",
      "missingPolicy": "omit-optional"
    },
    {
      "id": "openrouter-usage-monthly",
      "metricId": "usage-monthly",
      "kind": "spend",
      "unit": "currency",
      "scope": "api-key",
      "period": "unknown",
      "derivations": [],
      "currency": "USD",
      "description": "monthly spend USD",
      "missingPolicy": "omit-optional"
    },
    {
      "id": "openrouter-usage-total",
      "metricId": "usage-total",
      "kind": "spend",
      "unit": "currency",
      "scope": "api-key",
      "period": "lifetime",
      "derivations": [],
      "currency": "USD",
      "description": "total spend USD",
      "missingPolicy": "omit-optional"
    }
  ],
  "primaryPreference": [
    "openrouter-limit"
  ],
  "diagnosticCodes": [
    "openrouter-no-limit",
    "openrouter-free-tier"
  ],
  "reasonCodes": [],
  "fixtureIds": [
    "openrouter-synthetic-normal",
    "openrouter-synthetic-missing"
  ],
  "provenance": [],
  "login": {
    "mode": "guide",
    "note": "openrouter.ai Keys 页创建 key",
    "verified": false,
    "url": "https://openrouter.ai/keys"
  }
}
